{
  "verdict": "accepted",
  "score": 85,
  "strengths": [
    "Верно указано ключевое положение: любая модель фокусируется на определённых свойствах и опускает другие",
    "Приведён хороший практический пример с программным продуктом",
    "Пример демонстрирует разные типы описаний: маркетинговое, техническое, операционное"
  ],
  "issues": [
    {
      "criterion": "terminology",
      "issue": "Не использован термин 'описание системы' из курса",
      "suggestion": "Рекомендую использовать точную терминологию из материалов: 'описание системы' вместо 'описание части физического мира'"
    },
    {
      "criterion": "connections",
      "issue": "Не упомянута связь с понятием 'ментальное пространство'",
      "suggestion": "Можно дополнить ответ, отметив, что все эти описания существуют в ментальном пространстве, а сам продукт — в физическом"
    }
  ],
  "next_step": "Попробуйте привести ещё один пример из другой области — например, из бытовой жизни (описания квартиры: план БТИ, дизайн-проект, счёт за коммунальные услуги)",
  "criterion_scores": {
    "main_idea": 40,
    "own_example": 25,
    "terminology": 10,
    "completeness": 10
  },
  "checked_at": "2025-09-08T20:35:00Z",
  "model_used": "claude-3-5-sonnet-20241022"
}
